[
  {
    "id": "earn-nvda-2026-02-25",
    "title": "NVIDIA Earnings (Q4 FY2026)",
    "date": "2026-02-25",
    "time": "21:20",
    "timezone": "UTC",
    "type": "earnings",
    "company": "NVDA",
    "notes": "Verified from Yahoo Finance quote page (Earnings Date: Feb 25, 2026), checked 2026-02-22 UTC.",
    "recurring": false,
    "alert": "1d",
    "source_url": "https://finance.yahoo.com/quote/NVDA/"
  },
  {
    "id": "earn-hpq-2026-02-24",
    "title": "HP Inc. Earnings (Q1 FY2026)",
    "date": "2026-02-24",
    "time": "22:00",
    "timezone": "UTC",
    "type": "earnings",
    "company": "HPQ",
    "notes": "Verified from Yahoo Finance quote page (Earnings Date: Feb 24, 2026), checked 2026-02-22 UTC.",
    "recurring": false,
    "alert": "1d",
    "source_url": "https://finance.yahoo.com/quote/HPQ/"
  },
  {
    "id": "earn-adi-2026-05-21",
    "title": "Analog Devices Earnings (Q1 FY2026)",
    "date": "2026-05-21",
    "time": "12:00",
    "timezone": "UTC",
    "type": "earnings",
    "company": "ADI",
    "notes": "Verified (date marked estimated by source) from Yahoo Finance quote page (Earnings Date: May 21, 2026), checked 2026-02-22 UTC.",
    "recurring": false,
    "alert": "1d",
    "source_url": "https://finance.yahoo.com/quote/ADI/"
  },
  {
    "id": "earn-avgo-2026-03-04",
    "title": "Broadcom Earnings (Q1 FY2026)",
    "date": "2026-03-04",
    "time": "21:00",
    "timezone": "UTC",
    "type": "earnings",
    "company": "AVGO",
    "notes": "Verified from Yahoo Finance quote page (Earnings Date: Mar 4, 2026), checked 2026-02-22 UTC.",
    "recurring": false,
    "alert": "1d",
    "source_url": "https://finance.yahoo.com/quote/AVGO/"
  },
  {
    "id": "earn-mrvl-2026-03-05",
    "title": "Marvell Earnings (Q4 FY2026)",
    "date": "2026-03-05",
    "time": "21:00",
    "timezone": "UTC",
    "type": "earnings",
    "company": "MRVL",
    "notes": "Verified from Yahoo Finance quote page (Earnings Date: Mar 5, 2026), checked 2026-02-22 UTC.",
    "recurring": false,
    "alert": "1d",
    "source_url": "https://finance.yahoo.com/quote/MRVL/"
  },
  {
    "id": "earn-amd-2026-05-05",
    "title": "AMD Earnings (Q1 2026)",
    "date": "2026-05-05",
    "time": "22:00",
    "timezone": "UTC",
    "type": "earnings",
    "company": "AMD",
    "notes": "Verified (date marked estimated by source) from Yahoo Finance quote page (Earnings Date: May 5, 2026), checked 2026-02-22 UTC.",
    "recurring": false,
    "alert": "2d",
    "source_url": "https://finance.yahoo.com/quote/AMD/"
  },
  {
    "id": "earn-arm-2026-05-06",
    "title": "Arm Holdings Earnings (Q4 FY2026)",
    "date": "2026-05-06",
    "time": "20:00",
    "timezone": "UTC",
    "type": "earnings",
    "company": "ARM",
    "notes": "Verified from Yahoo Finance quote page (Earnings Date: May 6, 2026), checked 2026-02-22 UTC.",
    "recurring": false,
    "alert": "2d",
    "source_url": "https://finance.yahoo.com/quote/ARM/"
  },
  {
    "id": "earn-swks-2026-05-12",
    "title": "Skyworks Earnings (Q2 FY2026)",
    "date": "2026-05-12",
    "time": "20:00",
    "timezone": "UTC",
    "type": "earnings",
    "company": "SWKS",
    "notes": "Verified (date marked estimated by source) from Yahoo Finance quote page (Earnings Date: May 12, 2026), checked 2026-02-22 UTC.",
    "recurring": false,
    "alert": "2d",
    "source_url": "https://finance.yahoo.com/quote/SWKS/"
  },
  {
    "id": "earn-qrvo-2026-04-28",
    "title": "Qorvo Earnings (Q4 FY2026)",
    "date": "2026-04-28",
    "time": "20:00",
    "timezone": "UTC",
    "type": "earnings",
    "company": "QRVO",
    "notes": "Verified from Yahoo Finance quote page (Earnings Date: Apr 28, 2026), checked 2026-02-22 UTC.",
    "recurring": false,
    "alert": "2d",
    "source_url": "https://finance.yahoo.com/quote/QRVO/"
  },
  {
    "id": "earn-intc-2026-04-23",
    "title": "Intel Earnings (Q1 2026)",
    "date": "2026-04-23",
    "time": "20:00",
    "timezone": "UTC",
    "type": "earnings",
    "company": "INTC",
    "notes": "Verified from Yahoo Finance quote page (Earnings Date: Apr 23, 2026), checked 2026-02-22 UTC.",
    "recurring": false,
    "alert": "2d",
    "source_url": "https://finance.yahoo.com/quote/INTC/"
  },
  {
    "id": "earn-gfs-2026-05-05",
    "title": "GlobalFoundries Earnings (Q1 2026)",
    "date": "2026-05-05",
    "time": "11:00",
    "timezone": "UTC",
    "type": "earnings",
    "company": "GFS",
    "notes": "Verified (date marked estimated by source) from Yahoo Finance quote page (Earnings Date: May 5, 2026), checked 2026-02-22 UTC.",
    "recurring": false,
    "alert": "2d",
    "source_url": "https://finance.yahoo.com/quote/GFS/"
  },
  {
    "id": "earn-umc-2026-04-29",
    "title": "UMC Earnings (Q1 2026)",
    "date": "2026-04-29",
    "time": "06:00",
    "timezone": "UTC",
    "type": "earnings",
    "company": "UMC",
    "notes": "Verified (date marked estimated by source) from Yahoo Finance quote page (Earnings Date: Apr 29, 2026), checked 2026-02-22 UTC.",
    "recurring": false,
    "alert": "2d",
    "source_url": "https://finance.yahoo.com/quote/UMC/"
  },
  {
    "id": "earn-tsm-2026-04-16",
    "title": "TSMC Earnings (Q1 2026)",
    "date": "2026-04-16",
    "time": "06:00",
    "timezone": "UTC",
    "type": "earnings",
    "company": "TSM",
    "notes": "Verified from Yahoo Finance quote page (Earnings Date: Apr 16, 2026), checked 2026-02-22 UTC.",
    "recurring": false,
    "alert": "2d",
    "source_url": "https://finance.yahoo.com/quote/TSM/"
  },
  {
    "id": "earn-crdo-2026-03-02",
    "title": "Credo Technology Earnings (Q3 FY2026)",
    "date": "2026-03-02",
    "time": "21:00",
    "timezone": "UTC",
    "type": "earnings",
    "company": "CRDO",
    "notes": "Verified from Yahoo Finance quote page (Earnings Date: Mar 2, 2026), checked 2026-02-22 UTC.",
    "recurring": false,
    "alert": "1d",
    "source_url": "https://finance.yahoo.com/quote/CRDO/"
  },
  {
    "id": "earn-mediatek-2026-02-04",
    "title": "MediaTek Earnings (4Q25 Results)",
    "date": "2026-02-04",
    "time": "07:00",
    "timezone": "UTC",
    "type": "earnings",
    "company": "MediaTek",
    "notes": "Verified from MediaTek IR Events page (\"4Q25 Results \u2013 Investors Conference\" on Feb 4, 2026, 15:00 GMT+8), checked 2026-02-22 UTC.",
    "recurring": false,
    "alert": "2d",
    "source_url": "https://www.mediatek.com/investor-relations/ir-events"
  }
]